<?xml version="1.0" encoding="UTF-8" ?>
<xs:schema xmlns:xs="http://www.w3.org/2001/XMLSchema">
    <xs:element name="students">
        <xs:complexType>
            <xs:sequence>
                <xs:element name="student" type="student" minOccurs="1" maxOccurs="unbounded"/>
            </xs:sequence>
        </xs:complexType>
    </xs:element>

    <xs:complexType name="student">
        <xs:sequence>
            <xs:element name="firstname" type="xs:string"/>
            <xs:element name="lastname" type="xs:string"/>
            <xs:element name="birthdate" type="xs:date"/>
        </xs:sequence>
        <xs:attribute name="id" type="xs:integer" use="required"/>
    </xs:complexType>
</xs:schema>