<?xml version="1.0" encoding="UTF-8" ?>
<students xmlns:xsi="http://www.w3.org/2001/XMLSchema-instance"
          xsi:noNamespaceSchemaLocation="students.xsd">
    <student id="59">
        <firstname>Danni</firstname>
        <lastname>Davis</lastname>
        <birthdate>1986-05-10</birthdate>
    </student>

    <student id="35">
        <firstname>Hester</firstname>
        <lastname>Benji</lastname>
        <birthdate>1989-01-27</birthdate>
    </student>

    <student id="391">
        <firstname>Kylan</firstname>
        <lastname>Sydney</lastname>
        <birthdate>1991-05-10</birthdate>
    </student>
</students>